{
  "schemaVersion": "0.1.0",
  "sourceSchemaVersion": "0.1.0",
  "project": { "id": "project_uuid_pgcrypto", "name": "UUID Pgcrypto" },
  "conventions": {
    "naming": "snake_case",
    "identifierMaxLength": 63,
    "inheritanceStrategy": "JOINED",
    "identifierStrategy": "attribute-id-or-synthetic-uuid"
  },
  "tables": [
    {
      "id": "table_document",
      "logicalName": "Document",
      "physicalName": "document",
      "javaEntityName": "Document",
      "kind": "entity",
      "columns": [
        {
          "id": "column_document_id",
          "logicalName": "id",
          "physicalName": "id",
          "javaPropertyName": "id",
          "javaType": "UUID",
          "postgresType": "uuid",
          "umlType": "UUID",
          "nullable": false,
          "primaryKey": true,
          "generated": "UUID",
          "defaultValue": "gen_random_uuid()",
          "source": { "sourceIds": ["fixture"], "sourcePaths": ["/fixture"], "rule": "fixture" }
        },
        {
          "id": "column_document_title",
          "logicalName": "title",
          "physicalName": "title",
          "javaPropertyName": "title",
          "javaType": "String",
          "postgresType": "varchar(255)",
          "umlType": "String",
          "nullable": false,
          "primaryKey": false,
          "source": { "sourceIds": ["fixture"], "sourcePaths": ["/fixture"], "rule": "fixture" }
        }
      ],
      "primaryKey": {
        "id": "pk_document",
        "physicalName": "pk_document",
        "columnIds": ["column_document_id"],
        "source": { "sourceIds": ["fixture"], "sourcePaths": ["/fixture"], "rule": "fixture" }
      },
      "foreignKeys": [],
      "uniqueConstraints": [],
      "source": { "sourceIds": ["fixture"], "sourcePaths": ["/fixture"], "rule": "fixture" }
    }
  ],
  "diagnostics": []
}
