{
  "schemaVersion": "0.1.0",
  "sourceSchemaVersion": "0.1.0",
  "project": { "id": "project_self_reference", "name": "Self Reference" },
  "conventions": {
    "naming": "snake_case",
    "identifierMaxLength": 63,
    "inheritanceStrategy": "JOINED",
    "identifierStrategy": "attribute-id-or-synthetic-uuid"
  },
  "tables": [
    {
      "id": "table_category",
      "logicalName": "Category",
      "physicalName": "category",
      "javaEntityName": "Category",
      "kind": "entity",
      "columns": [
        {
          "id": "column_category_id",
          "logicalName": "id",
          "physicalName": "id",
          "javaPropertyName": "id",
          "javaType": "Long",
          "postgresType": "bigint",
          "umlType": "Long",
          "nullable": false,
          "primaryKey": true,
          "source": { "sourceIds": ["fixture"], "sourcePaths": ["/fixture"], "rule": "fixture" }
        },
        {
          "id": "column_category_parent_id",
          "logicalName": "parentId",
          "physicalName": "parent_id",
          "javaPropertyName": "parentId",
          "javaType": "Long",
          "postgresType": "bigint",
          "umlType": "Long",
          "nullable": true,
          "primaryKey": false,
          "source": { "sourceIds": ["fixture"], "sourcePaths": ["/fixture"], "rule": "fixture" }
        },
        {
          "id": "column_category_name",
          "logicalName": "name",
          "physicalName": "name",
          "javaPropertyName": "name",
          "javaType": "String",
          "postgresType": "varchar(255)",
          "umlType": "String",
          "nullable": false,
          "primaryKey": false,
          "source": { "sourceIds": ["fixture"], "sourcePaths": ["/fixture"], "rule": "fixture" }
        }
      ],
      "primaryKey": {
        "id": "pk_category",
        "physicalName": "pk_category",
        "columnIds": ["column_category_id"],
        "source": { "sourceIds": ["fixture"], "sourcePaths": ["/fixture"], "rule": "fixture" }
      },
      "foreignKeys": [
        {
          "id": "fk_category_parent",
          "physicalName": "fk_category_parent",
          "columnIds": ["column_category_parent_id"],
          "referencedTableId": "table_category",
          "referencedColumnIds": ["column_category_id"],
          "onDelete": "SET_NULL",
          "source": { "sourceIds": ["fixture"], "sourcePaths": ["/fixture"], "rule": "fixture" }
        }
      ],
      "uniqueConstraints": [],
      "source": { "sourceIds": ["fixture"], "sourcePaths": ["/fixture"], "rule": "fixture" }
    }
  ],
  "diagnostics": []
}
